{
  "$schema": "https://json-schema.org/draft/2020-12/schema",
  "$comment": "Generated by scripts/schemas from trialfolio.contracts.attempt.AuthenticationRecord, in serialization mode. Validation and serialization modes give the same schema. Never edit it by hand.",
  "additionalProperties": false,
  "description": "The authentication record, `authenticating.json`, written durably before an experiment's\nattempt makes Trial Folio's own authentication call, so the budget counts the call even when\nthe process is killed before its exchange is recorded (experiment attempts). An attempt\nthat sends with a token its session already holds has none.",
  "properties": {
    "schema_version": {
      "const": "1.0.0",
      "title": "Schema Version",
      "type": "string"
    },
    "trialfolio_version": {
      "pattern": "^(0|[1-9][0-9]*)\\.(0|[1-9][0-9]*)\\.(0|[1-9][0-9]*)$",
      "title": "Trialfolio Version",
      "type": "string"
    },
    "attempt_id": {
      "format": "uuid4",
      "title": "Attempt Id",
      "type": "string"
    },
    "case_id": {
      "pattern": "^case-[0-9a-f]{16}$",
      "title": "Case Id",
      "type": "string"
    },
    "plan_hash": {
      "description": "The plan the attempt runs under.",
      "pattern": "^sha256:[0-9a-f]{64}$",
      "title": "Plan Hash",
      "type": "string"
    },
    "session": {
      "description": "The number of the session that started the attempt.",
      "maximum": 9007199254740991,
      "minimum": 1,
      "title": "Session",
      "type": "integer"
    },
    "sequence": {
      "description": "The attempt's place in its session: 1 for the first attempt it starts.",
      "maximum": 9007199254740991,
      "minimum": 1,
      "title": "Sequence",
      "type": "integer"
    },
    "repeat_of": {
      "anyOf": [
        {
          "format": "uuid4",
          "type": "string"
        },
        {
          "type": "null"
        }
      ],
      "description": "The attempt that `--repeat`'s confirmation named, for an attempt it started; null for any\nother.",
      "title": "Repeat Of"
    },
    "started_at": {
      "format": "date-time",
      "title": "Started At",
      "type": "string"
    }
  },
  "required": [
    "schema_version",
    "trialfolio_version",
    "attempt_id",
    "case_id",
    "plan_hash",
    "session",
    "sequence",
    "repeat_of",
    "started_at"
  ],
  "title": "AuthenticationRecord",
  "type": "object"
}
