{
  "schema_version": "1.0.0",
  "trialfolio_version": "0.3.0",
  "attempt_id": "de2e8c99-c930-4e1f-a0ce-21c4558dc69c",
  "case_id": "case-e29404ddebf86363",
  "plan_hash": "sha256:ed9d5bb8d4e1b232b1768c2f7da08c0c328dd71a1d1f708d0205f1d96055979b",
  "session": 1,
  "sequence": 1,
  "repeat_of": null,
  "started_at": "2026-10-03T14:00:02Z"
}
